{
  "kind": "realization",
  "id": "profile-order-realization",
  "version": "0.1.0",
  "specification": { "kind": "specification", "id": "profile-order-stack", "version": "0.1.0" },
  "adapter": { "id": "adapter", "version": "0.1.0", "protocol": "fixture-v1", "entrypoint": "fixture", "assumptions": [] },
  "implementation": { "language": "fixture", "languageVersion": "1", "target": "fixture", "runtime": "fixture", "interfaceMechanism": "fixture", "buildSystem": "fixture", "buildInstructions": "fixture", "executionInstructions": "fixture" },
  "capabilities": [],
  "limitations": [],
  "supportedProfiles": [
    { "kind": "realizationProfile", "id": "profile-a", "version": "0.1.0" },
    { "kind": "realizationProfile", "id": "profile-b", "version": "0.1.0" }
  ]
}
