{
  "kind": "realization", "id": "stack-rust", "version": "0.1.0",
  "specification": {"kind": "specification", "id": "stack", "version": "0.1.0"},
  "adapter": {
    "id": "stack-rust-json-adapter", "version": "0.1.0", "protocol": "stack-runner-json-v1",
    "entrypoint": "implementations/rust/src/main.rs",
    "assumptions": ["The adapter faithfully exposes the Rust Realization.", "Reported events are complete for the adapter-observed boundary."]
  },
  "implementation": {
    "language": "Rust", "languageVersion": "1.96.1", "target": "local native child process",
    "runtime": "native executable", "interfaceMechanism": "NDJSON messages over stdin and stdout",
    "buildSystem": "direct rustc, edition 2024", "buildInstructions": "Use RUSTC with an explicit CC linker as documented in implementations/rust/README.md.",
    "executionInstructions": "Run the built adapter as a lockstep child process."
  },
  "capabilities": ["stack.empty", "stack.push", "stack.pop"],
  "limitations": ["Tracer profile only; element values are integers from -2 through 2.", "The std-only codec is bounded protocol infrastructure, not a general JSON implementation.", "Sequence integers use canonical nonnegative decimal spelling; alternate integral JSON spellings reopen the protocol boundary.", "No performance, concurrency, remote transport, registry discovery, or cross-language interoperation claim."],
  "supportedProfiles": [{"kind": "realizationProfile", "id": "stack-default", "version": "0.1.0"}]
}
