{"adapter":{"assumptions":["The adapter faithfully exposes the named Realization.","Reported events are complete for the adapter-observed boundary."],"entrypoint":"implementations/ordered-map/typescript/adapter.ts","id":"ordered-map-typescript-json-adapter","protocol":"ordered-map-runner-json-v1","version":"0.1.0"},"capabilities":["ordered-map.empty","ordered-map.put","ordered-map.lookup","ordered-map.entries"],"id":"ordered-map-typescript","implementation":{"buildInstructions":"Run the offline Deno check documented in implementations/ordered-map/typescript/README.md.","buildSystem":"dependency-free Deno check","executionInstructions":"Run adapter.ts with Deno's no-config, no-lock, no-npm, no-remote, and no-prompt flags.","interfaceMechanism":"NDJSON messages over stdin and stdout","language":"TypeScript","languageVersion":"6.0.3","runtime":"Deno 2.9.2","target":"local Deno child process"},"kind":"realization","limitations":["Evidence is bounded to ordered-map-ascii-fold/0.1.0 and its exact campaign.","Reported events cover only the adapter-observed invocation boundary.","No performance, concurrency, remote transport, registry discovery, or interoperation claim."],"specification":{"id":"ordered-map","kind":"specification","version":"0.1.0"},"supportedProfiles":[{"id":"ordered-map-ascii-fold","kind":"realizationProfile","version":"0.1.0"}],"version":"0.1.0"}
