{"adapter":{"assumptions":["The adapter faithfully exposes the named Realization.","Reported events are complete for the adapter-observed boundary."],"entrypoint":"implementations/ordered-map/rust/src/main.rs","id":"ordered-map-rust-json-adapter","protocol":"ordered-map-runner-json-v1","version":"0.1.0"},"capabilities":["ordered-map.empty","ordered-map.put","ordered-map.lookup","ordered-map.entries"],"id":"ordered-map-rust","implementation":{"buildInstructions":"Use RUSTC with the explicit GCC linker as documented in implementations/ordered-map/rust/README.md.","buildSystem":"direct rustc, edition 2024","executionInstructions":"Run the built adapter as a lockstep child process.","interfaceMechanism":"NDJSON messages over stdin and stdout","language":"Rust","languageVersion":"1.96.1","runtime":"native executable","target":"local native child process"},"kind":"realization","limitations":["Evidence is bounded to ordered-map-ascii-fold/0.1.0 and its exact campaign.","Reported events cover only the adapter-observed invocation boundary.","No performance, concurrency, remote transport, registry discovery, or interoperation claim."],"specification":{"id":"ordered-map","kind":"specification","version":"0.1.0"},"supportedProfiles":[{"id":"ordered-map-ascii-fold","kind":"realizationProfile","version":"0.1.0"}],"version":"0.1.0"}
