{
  "kind": "realization", "id": "stack-rust", "version": "0.2.0",
  "specification": {"kind": "specification", "id": "stack", "version": "0.2.0"},
  "adapter": {
    "id": "stack-rust-json-adapter", "version": "0.1.0", "protocol": "stack-runner-json-v1",
    "entrypoint": "implementations/rust/src/main.rs",
    "assumptions": ["The unchanged adapter is only a candidate for Stack 0.2.0 until fresh Evidence exists.", "Reported events are complete for the adapter-observed boundary."]
  },
  "implementation": {
    "language": "Rust", "languageVersion": "1.96.1", "target": "local native child process",
    "runtime": "native executable", "interfaceMechanism": "NDJSON messages over stdin and stdout",
    "buildSystem": "direct rustc, edition 2024", "buildInstructions": "Use RUSTC with an explicit CC linker as documented in implementations/rust/README.md.",
    "executionInstructions": "Run the built adapter as a lockstep child process. No Stack 0.2.0 conformance run is claimed."
  },
  "capabilities": ["stack.empty", "stack.push", "stack.pop"],
  "limitations": ["No Evidence supports this candidate against Stack 0.2.0.", "The optional metrics.emit revision has not been exercised.", "No performance, concurrency, remote transport, registry discovery, or cross-language interoperation claim."],
  "supportedProfiles": [{"kind": "realizationProfile", "id": "stack-default", "version": "0.1.0"}]
}
